ISBN,Title,Category,Author
234,Vahana Masterclass,education,Alfredo Covellis
23,Right Under Our Nose,education,	R. Giridharan
544,Making of a General-A Himalayan Echo,education,Lt. Gen. Konsam Himalay Singh
342,The Commonwealth of Cricket	,sports,Ramachandra Guha
345,The Little Book of Encouragement,education,	Dalai Lama
232,Beautiful Things A Memoir	,education,Hunter Biden 
543,By Many a Happy Accident: Recollections of a Life,education,Former Vice President Mohammad Hamid Ansari
345,Unfinished	Priyanka ,novel,Chopra Jonas
344,The Terrible,Novel,Meghna Pant
65,ASOCA: A Sutra,Novel,Irwin Allan Sealy
46,Rashtra Pratham  82 Varshon ki Swarnim Gatha,novel,	Amit Shah
65,Stories I Must Tell The Journey of an Actor,biography,Kabir Bedi
654,Advantage India: The Story of Indian Tennis	,biography,Anindya Dutta
643,Dynasty to Democracy: The Untold Story of Smriti Irani’s Triumph,Novel,Anant Vijay
53,Battle Ready for 21st Century,novel,Lt Gen AK Singh and Brig. Narendra Kumar
546,My Experiments with Silence	,biography,Samir Soni
42,Names of the Women,novel,Jeet Thayil
123,As you like it ,Novel,William Sakeshpear
124,Python Basic,Education,james William
235,Machine learning for all,education ,Ankush Bist
126,OOPs with C++,education,Amit Kumar
234,java for beginners,education,C.k William
112,saiki,comic,fujitaru

